A2: Timing of float functions in [ns]
B4: RP2040-B2 | C4: RP2040-B2 | D4: RP2350-A2 | E4: RP2350-A2 | F4: RP2350-A2 | G4: RP2350-A2 | H4: RP2350-A2
A5: function | B5: @125MHz | C5: @125MHz | D5: @150MHz | E5: @150MHz | F5: @150MHz | G5: @150MHz | H5: @150MHz | I5: RISC-V
B6: libc | C6: fast | D6: ARM libc | E6: ARM DCP | F6: ARM DCP+VFP | G6: RISC-V libc | H6: RISC-V fast | I6: speed-up
A7: sub-normals? | B7: yes | C7: no | D7: yes | E7: no | F7: yes | G7: yes | H7: no
A8: copysignf | B8: 40 | C8: 40 | D8: 6 | E8: 6 | F8: 6 | G8: 33 | H8: 40 | I8: =G8/H8 -> 0.82499999999999996
A9: isintf | B9: 84 | C9: 84 | D9: 41 | E9: 41 | F9: 41 | G9: 50 | H9: 50 | I9: =G9/H9 -> 1
A10: isoddintf | B10: 58 | C10: 59 | D10: 33 | E10: 33 | F10: 33 | G10: 52 | H10: 52 | I10: =G10/H10 -> 1
A11: ispow2f | B11: 87 | C11: 88 | D11: 53 | E11: 53 | F11: 53 | G11: 33 | H11: 33 | I11: =G11/H11 -> 1
A12: ldexpf | B12: 1710 | C12: 125 | D12: 1280 | E12: 64 | F12: 64 | G12: 896 | H12: 85 | I12: =G12/H12 -> 10.541176470588235
A13: fadd | B13: 896 | C13: 577 | D13: 262 | E13: 53 | F13: 33 | G13: 532 | H13: 180 | I13: =G13/H13 -> 2.9555555555555557
A14: fsub | B14: 987 | C14: 601 | D14: 265 | E14: 53 | F14: 40 | G14: 552 | H14: 186 | I14: =G14/H14 -> 2.967741935483871
A15: fmul | B15: 1290 | C15: 469 | D15: 291 | E15: 73 | F15: 33 | G15: 793 | H15: 211 | I15: =G15/H15 -> 3.7582938388625591
A16: fsqr | B16: 1290 | C16: 479 | D16: 312 | E16: 27 | F16: 27 | G16: 800 | H16: 267 | I16: =G16/H16 -> 2.9962546816479403
A17: fdiv | B17: 3580 | C17: 707 | D17: 888 | E17: 133 | F17: 126 | G17: 1270 | H17: 464 | I17: =G17/H17 -> 2.7370689655172415
A18: frec | B18: 3680 | C18: 725 | D18: 903 | E18: 127 | F18: 127 | G18: 1320 | H18: 544 | I18: =G18/H18 -> 2.4264705882352939
A19: fmodf | B19: 1040 | C19: 334 | D19: 697 | E19: 145 | F19: 145 | G19: 522 | H19: 178 | I19: =G19/H19 -> 2.9325842696629212
A20: remquof | B20: 3220 | C20: 519 | D20: 1730 | E20: 249 | F20: 249 | G20: 1710 | H20: 233 | I20: =G20/H20 -> 7.3390557939914167
A21: remainderf | B21: 4120 | C21: 612 | D21: 2040 | E21: 273 | F21: 273 | G21: 2410 | H21: 264 | I21: =G21/H21 -> 9.1287878787878789
A22: fcmp | B22: 1110 | C22: 180 | D22: 893 | E22: 73 | F22: 73 | G22: 424 | H22: 442 | I22: =G22/H22 -> 0.95927601809954754
A23: fcmpeq | B23: 496 | C23: 310 | D23: 433 | E23: 53 | F23: 53 | G23: 167 | H23: 174 | I23: =G23/H23 -> 0.95977011494252873
A24: fcmplt | B24: 571 | C24: 310 | D24: 440 | E24: 60 | F24: 60 | G24: 197 | H24: 208 | I24: =G24/H24 -> 0.94711538461538458
A25: fcmple | B25: 571 | C25: 314 | D25: 433 | E25: 60 | F25: 60 | G25: 197 | H25: 208 | I25: =G25/H25 -> 0.94711538461538458
A26: fcmpge | B26: 570 | C26: 354 | D26: 466 | E26: 60 | F26: 60 | G26: 214 | H26: 205 | I26: =G26/H26 -> 1.0439024390243903
A27: fcmpgt | B27: 570 | C27: 350 | D27: 460 | E27: 60 | F27: 60 | G27: 208 | H27: 198 | I27: =G27/H27 -> 1.0505050505050506
A28: fcmpun | B28: 128 | C28: 64 | D28: 60 | E28: 53 | F28: 53 | G28: 40 | H28: 40 | I28: =G28/H28 -> 1
A29: int2float | B29: 846 | C29: 346 | D29: 260 | E29: 54 | F29: 54 | G29: 528 | H29: 128 | I29: =G29/H29 -> 4.125
A30: uint2float | B30: 794 | C30: 329 | D30: 254 | E30: 54 | F30: 54 | G30: 464 | H30: 108 | I30: =G30/H30 -> 4.2962962962962967
A31: int642float | B31: 6420 | C31: 474 | D31: 277 | E31: 144 | F31: 144 | G31: 639 | H31: 257 | I31: =G31/H31 -> 2.4863813229571985
A32: uint642float | B32: 6200 | C32: 438 | D32: 267 | E32: 114 | F32: 114 | G32: 559 | H32: 250 | I32: =G32/H32 -> 2.2360000000000002
A33: fix2float | B33: 2540 | C33: 454 | D33: 1550 | E33: 121 | F33: 121 | G33: 1360 | H33: 221 | I33: =G33/H33 -> 6.1538461538461542
A34: ufix2float | B34: 2480 | C34: 445 | D34: 1550 | E34: 94 | F34: 94 | G34: 1290 | H34: 226 | I34: =G34/H34 -> 5.7079646017699117
A35: fix642float | B35: 8110 | C35: 445 | D35: 1570 | E35: 136 | F35: 136 | G35: 1470 | H35: 250 | I35: =G35/H35 -> 5.88
A36: ufix642float | B36: 7890 | C36: 417 | D36: 1560 | E36: 106 | F36: 106 | G36: 1390 | H36: 250 | I36: =G36/H36 -> 5.56
A37: float2int_z | B37: 251 | C37: 76 | D37: 163 | E37: 54 | F37: 54 | G37: 136 | H37: 53 | I37: =G37/H37 -> 2.5660377358490565
A38: float2int | B38: 1350 | C38: 346 | D38: 719 | E38: 40 | F38: 40 | G38: 767 | H38: 196 | I38: =G38/H38 -> 3.9132653061224492
A39: float2uint | B39: 10900 | C39: 310 | D39: 2010 | E39: 54 | F39: 54 | G39: 189 | H39: 167 | I39: =G39/H39 -> 1.1317365269461077
A40: float2int64_z | B40: 7040 | C40: 419 | D40: 1460 | E40: 110 | F40: 110 | G40: 178 | H40: 286 | I40: =G40/H40 -> 0.6223776223776224
A41: float2int64 | B41: 7820 | C41: 376 | D41: 1950 | E41: 176 | F41: 176 | G41: 791 | H41: 254 | I41: =G41/H41 -> 3.1141732283464565
A42: float2uint64 | B42: 5690 | C42: 160 | D42: 1180 | E42: 87 | F42: 87 | G42: 304 | H42: 112 | I42: =G42/H42 -> 2.7142857142857144
A43: float2fix | B43: 3310 | C43: 339 | D43: 2120 | E43: 189 | F43: 189 | G43: 1800 | H43: 190 | I43: =G43/H43 -> 9.473684210526315
A44: float2ufix | B44: 12400 | C44: 302 | D44: 3400 | E44: 236 | F44: 236 | G44: 1200 | H44: 159 | I44: =G44/H44 -> 7.5471698113207548
A45: float2fix64 | B45: 9400 | C45: 368 | D45: 3340 | E45: 314 | F45: 314 | G45: 1860 | H45: 247 | I45: =G45/H45 -> 7.5303643724696352
A46: float2ufix64 | B46: 7890 | C46: 154 | D46: 2650 | E46: 81 | F46: 81 | G46: 1300 | H46: 115 | I46: =G46/H46 -> 11.304347826086957
A47: truncf | B47: 139 | C47: 74 | D47: 89 | E47: 40 | F47: 40 | G47: 86 | H47: 55 | I47: =G47/H47 -> 1.5636363636363637
A48: roundf | B48: 148 | C48: 85 | D48: 109 | E48: 52 | F48: 52 | G48: 91 | H48: 69 | I48: =G48/H48 -> 1.318840579710145
A49: floorf | B49: 949 | C49: 111 | D49: 487 | E49: 70 | F49: 70 | G49: 579 | H49: 71 | I49: =G49/H49 -> 8.1549295774647881
A50: ceilf | B50: 941 | C50: 113 | D50: 462 | E50: 68 | F50: 68 | G50: 553 | H50: 73 | I50: =G50/H50 -> 7.5753424657534243
A51: sqrtf | B51: 5880 | C51: 516 | D51: 3470 | E51: 214 | F51: 214 | G51: 3440 | H51: 354 | I51: =G51/H51 -> 9.7175141242937855
A52: deg2radf | B52: 1320 | C52: 649 | D52: 304 | E52: 34 | F52: 34 | G52: 820 | H52: 303 | I52: =G52/H52 -> 2.7062706270627062
A53: rad2degf | B53: 1320 | C53: 658 | D53: 302 | E53: 34 | F53: 34 | G53: 828 | H53: 297 | I53: =G53/H53 -> 2.7878787878787881
A54: sinf | B54: 20300 | C54: 4690 | D54: 6720 | E54: 666 | F54: 387 | G54: 13200 | H54: 736 | I54: =G54/H54 -> 17.934782608695652
A55: sinf_deg | B55: 21600 | C55: 5300 | D55: 7090 | E55: 717 | F55: 441 | G55: 14000 | H55: 680 | I55: =G55/H55 -> 20.588235294117649
A56: cosf | B56: 22100 | C56: 4770 | D56: 7060 | E56: 646 | F56: 365 | G56: 14100 | H56: 766 | I56: =G56/H56 -> 18.407310704960835
A57: cosf_deg | B57: 23800 | C57: 5380 | D57: 7570 | E57: 685 | F57: 425 | G57: 15200 | H57: 699 | I57: =G57/H57 -> 21.745350500715308
A58: sincosf | B58: 43200 | C58: 4770 | D58: 14000 | E58: 940 | F58: 574 | G58: 27600 | H58: 1120 | I58: =G58/H58 -> 24.642857142857142
A59: sincosf_deg | B59: 44000 | C59: 5440 | D59: 14400 | E59: 983 | F59: 622 | G59: 28200 | H59: 1060 | I59: =G59/H59 -> 26.60377358490566
A60: tanf | B60: 40000 | C60: 5410 | D60: 13000 | E60: 1080 | F60: 625 | G60: 25500 | H60: 1610 | I60: =G60/H60 -> 15.838509316770187
A61: tanf_deg | B61: 42200 | C61: 6020 | D61: 13400 | E61: 1120 | F61: 675 | G61: 26300 | H61: 1550 | I61: =G61/H61 -> 16.967741935483872
A62: cotanf | B62: 44400 | C62: 6290 | D62: 14500 | E62: 1280 | F62: 817 | G62: 27500 | H62: 1600 | I62: =G62/H62 -> 17.1875
A63: cotanf_deg | B63: 46500 | C63: 6900 | D63: 14700 | E63: 1320 | F63: 858 | G63: 28000 | H63: 1540 | I63: =G63/H63 -> 18.181818181818183
A64: asinf | B64: 31000 | C64: 7970 | D64: 10200 | E64: 1160 | F64: 764 | G64: 18600 | H64: 542 | I64: =G64/H64 -> 34.317343173431738
A65: asinf_deg | B65: 32100 | C65: 8580 | D65: 10400 | E65: 1260 | F65: 866 | G65: 19300 | H65: 550 | I65: =G65/H65 -> 35.090909090909093
A66: acosf | B66: 31000 | C66: 7820 | D66: 10600 | E66: 1160 | F66: 738 | G66: 19100 | H66: 592 | I66: =G66/H66 -> 32.263513513513516
A67: acosf_deg | B67: 32400 | C67: 8470 | D67: 10800 | E67: 1250 | F67: 840 | G67: 19600 | H67: 578 | I67: =G67/H67 -> 33.910034602076124
A68: atanf | B68: 29400 | C68: 5360 | D68: 8910 | E68: 917 | F68: 525 | G68: 18700 | H68: 998 | I68: =G68/H68 -> 18.737474949899799
A69: atanf_deg | B69: 31000 | C69: 6000 | D69: 9120 | E69: 1010 | F69: 624 | G69: 19500 | H69: 1050 | I69: =G69/H69 -> 18.571428571428573
A70: acotanf | B70: 30700 | C70: 6400 | D70: 9460 | E70: 1090 | F70: 688 | G70: 19400 | H70: 1050 | I70: =G70/H70 -> 18.476190476190474
A71: acotanf_deg | B71: 32200 | C71: 7070 | D71: 9680 | E71: 1180 | F71: 786 | G71: 19900 | H71: 1050 | I71: =G71/H71 -> 18.952380952380953
A72: atan2f | B72: 34400 | C72: 5180 | D72: 10300 | E72: 799 | F72: 458 | G72: 20600 | H72: 1790 | I72: =G72/H72 -> 11.508379888268156
A73: atanf2_deg | B73: 35500 | C73: 5790 | D73: 10500 | E73: 895 | F73: 558 | G73: 21300 | H73: 2080 | I73: =G73/H73 -> 10.240384615384615
A74: sinhf | B74: 36000 | C74: 4730 | D74: 10900 | E74: 496 | F74: 373 | G74: 21200 | H74: 682 | I74: =G74/H74 -> 31.085043988269796
A75: coshf | B75: 33500 | C75: 9460 | D75: 11800 | E75: 1090 | F75: 786 | G75: 19700 | H75: 1410 | I75: =G75/H75 -> 13.971631205673759
A76: tanhf | B76: 35300 | C76: 3170 | D76: 10500 | E76: 339 | F76: 282 | G76: 20500 | H76: 819 | I76: =G76/H76 -> 25.03052503052503
A77: asinhf | B77: 38800 | C77: 4320 | D77: 12700 | E77: 367 | F77: 302 | G77: 23000 | H77: 1080 | I77: =G77/H77 -> 21.296296296296298
A78: acoshf | B78: 44900 | C78: 10100 | D78: 16200 | E78: 711 | F78: 590 | G78: 26700 | H78: 2630 | I78: =G78/H78 -> 10.152091254752852
A79: atanhf | B79: 37800 | C79: 2720 | D79: 11700 | E79: 260 | F79: 206 | G79: 22600 | H79: 677 | I79: =G79/H79 -> 33.382570162481535
A80: expf | B80: 23700 | C80: 4240 | D80: 8010 | E80: 311 | F80: 280 | G80: 13700 | H80: 467 | I80: =G80/H80 -> 29.336188436830835
A81: exp2f | B81: 78600 | C81: 4860 | D81: 23100 | E81: 352 | F81: 325 | G81: 47100 | H81: 433 | I81: =G81/H81 -> 108.77598152424942
A82: exp10f | B82: 97200 | C82: 4860 | D82: 34300 | E82: 352 | F82: 327 | G82: 60500 | H82: 530 | I82: =G82/H82 -> 114.15094339622641
A83: logf | B83: 23500 | C83: 6220 | D83: 7590 | E83: 444 | F83: 307 | G83: 13800 | H83: 617 | I83: =G83/H83 -> 22.366288492706644
A84: log2f | B84: 26700 | C84: 6850 | D84: 8940 | E84: 544 | F84: 407 | G84: 15500 | H84: 650 | I84: =G84/H84 -> 23.846153846153847
A85: log10f | B85: 26300 | C85: 6860 | D85: 8820 | E85: 543 | F85: 407 | G85: 16400 | H85: 676 | I85: =G85/H85 -> 24.260355029585799
A86: expm1f | B86: 28100 | C86: 3510 | D86: 8570 | E86: 320 | F86: 284 | G86: 17400 | H86: 595 | I86: =G86/H86 -> 29.243697478991596
A87: log1pf | B87: 14600 | C87: 2910 | D87: 4560 | E87: 211 | F87: 163 | G87: 8930 | H87: 392 | I87: =G87/H87 -> 22.780612244897959
A88: fmaf | B88: 5820 | C88: 1190 | D88: 1350 | E88: 53 | F88: 53 | G88: 3040 | H88: 476 | I88: =G88/H88 -> 6.3865546218487399
A89: powintf | B89: 60400 | C89: 7370 | D89: 20300 | E89: 862 | F89: 792 | G89: 37000 | H89: 1560 | I89: =G89/H89 -> 23.717948717948719
A90: powf | B90: 51700 | C90: 10500 | D90: 16600 | E90: 1020 | F90: 967 | G90: 31000 | H90: 1720 | I90: =G90/H90 -> 18.023255813953487
A91: hypotf | B91: 17100 | C91: 2780 | D91: 6030 | E91: 451 | F91: 451 | G91: 8460 | H91: 1380 | I91: =G91/H91 -> 6.1304347826086953
A92: cbrtf | B92: 17500 | C92: 11700 | D92: 5670 | E92: 1190 | F92: 998 | G92: 8320 | H92: 1640 | I92: =G92/H92 -> 5.0731707317073171
A93: absf | B93: 15 | C93: 16 | D93: 7 | E93: 7 | F93: 7 | G93: 7 | H93: 13 | I93: =G93/H93 -> 0.53846153846153844
A94: float2double | B94: 87 | C94: 88 | D94: 147 | E94: 34 | F94: 34 | G94: 215 | H94: 215 | I94: =G94/H94 -> 1
A95: average: | B95: =AVERAGE(B8:B94) -> 17282.160919540231 | C95: =AVERAGE(C8:C94) -> 2847.9195402298851 | D95: =AVERAGE(D8:D94) -> 5559.6896551724139 | E95: =AVERAGE(E8:E94) -> 397.01149425287355 | F95: =AVERAGE(F8:F94) -> 291.05747126436779 | G95: =AVERAGE(G8:G94) -> 9950.7356321839088 | H95: =AVERAGE(H8:H94) -> 566.16091954022988 | I95: =AVERAGE(I8:I94) -> 13.556518865782918
A96: median: | B96: =MEDIAN(B8:B94) -> 7890 | C96: =MEDIAN(C8:C94) -> 612 | D96: =MEDIAN(D8:D94) -> 2040 | E96: =MEDIAN(E8:E94) -> 189 | F96: =MEDIAN(F8:F94) -> 176 | G96: =MEDIAN(G8:G94) -> 1710 | H96: =MEDIAN(H8:H94) -> 303 | I96: =MEDIAN(I8:I94) -> 7.5471698113207548
A99: Timing of double functions in [ns]
B101: RP2040-B2 | C101: RP2040-B2 | D101: RP2350-A2 | E101: RP2350-A2 | F101: RP2350-A2 | G101: RP2350-A2 | H101: RP2350-A2
A102: function | B102: @125MHz | C102: @125MHz | D102: @150MHz | E102: @150MHz | F102: @150MHz | G102: @150MHz | H102: @150MHz | I102: RISC-V
B103: libc | C103: fast | D103: ARM libc | E103: ARM DCP | F103: ARM DCP+VFP | G103: RISC-V libc | H103: RISC-V fast | I103: speed-up
A104: sub-normals? | B104: yes | C104: no | D104: yes | E104: no | F104: no | G104: yes | H104: no
A105: copysign | B105: 136 | C105: 136 | D105: 30 | E105: 30 | F105: 30 | G105: 27 | H105: 53 | I105: =G105/H105 -> 0.50943396226415094
A106: isintd | B106: 203 | C106: 203 | D106: 56 | E106: 56 | F106: 56 | G106: 58 | H106: 52 | I106: =G106/H106 -> 1.1153846153846154
A107: isoddintd | B107: 154 | C107: 155 | D107: 40 | E107: 40 | F107: 40 | G107: 53 | H107: 46 | I107: =G107/H107 -> 1.1521739130434783
A108: ispow2d | B108: 110 | C108: 111 | D108: 46 | E108: 46 | F108: 46 | G108: 59 | H108: 53 | I108: =G108/H108 -> 1.1132075471698113
A109: ldexp | B109: 2490 | C109: 263 | D109: 1380 | E109: 121 | F109: 121 | G109: 1040 | H109: 85 | I109: =G109/H109 -> 12.235294117647058
A110: dadd | B110: 1350 | C110: 659 | D110: 308 | E110: 60 | F110: 60 | G110: 674 | H110: 489 | I110: =G110/H110 -> 1.378323108384458
A111: dsub | B111: 1460 | C111: 698 | D111: 315 | E111: 60 | F111: 60 | G111: 695 | H111: 496 | I111: =G111/H111 -> 1.4012096774193548
A112: dmul | B112: 3070 | C112: 1220 | D112: 472 | E112: 173 | F112: 173 | G112: 1390 | H112: 529 | I112: =G112/H112 -> 2.6275992438563329
A113: dsqr | B113: 3070 | C113: 1230 | D113: 513 | E113: 274 | F113: 274 | G113: 1420 | H113: 537 | I113: =G113/H113 -> 2.644320297951583
A114: ddiv | B114: 3950 | C114: 1500 | D114: 3290 | E114: 233 | F114: 233 | G114: 2480 | H114: 824 | I114: =G114/H114 -> 3.0097087378640777
A115: drec | B115: 4080 | C115: 1520 | D115: 3410 | E115: 354 | F115: 354 | G115: 2580 | H115: 826 | I115: =G115/H115 -> 3.1234866828087169
A116: fmod | B116: 2020 | C116: 410 | D116: 921 | E116: 165 | F116: 165 | G116: 750 | H116: 177 | I116: =G116/H116 -> 4.2372881355932206
A117: remquo | B117: 6180 | C117: 478 | D117: 1940 | E117: 232 | F117: 232 | G117: 2540 | H117: 207 | I117: =G117/H117 -> 12.270531400966183
A118: remainder | B118: 7900 | C118: 606 | D118: 2590 | E118: 328 | F118: 328 | G118: 3590 | H118: 236 | I118: =G118/H118 -> 15.211864406779661
A119: dcmp | B119: 1700 | C119: 272 | D119: 923 | E119: 399 | F119: 399 | G119: 515 | H119: 510 | I119: =G119/H119 -> 1.0098039215686274
A120: dcmpeq | B120: 710 | C120: 390 | D120: 432 | E120: 60 | F120: 60 | G120: 180 | H120: 173 | I120: =G120/H120 -> 1.0404624277456647
A121: dcmplt | B121: 881 | C121: 390 | D121: 425 | E121: 66 | F121: 66 | G121: 221 | H121: 224 | I121: =G121/H121 -> 0.9866071428571429
A122: dcmple | B122: 881 | C122: 394 | D122: 432 | E122: 66 | F122: 66 | G122: 222 | H122: 224 | I122: =G122/H122 -> 0.9910714285714286
A123: dcmpge | B123: 869 | C123: 458 | D123: 472 | E123: 66 | F123: 66 | G123: 235 | H123: 224 | I123: =G123/H123 -> 1.0491071428571428
A124: dcmpgt | B124: 868 | C124: 455 | D124: 478 | E124: 66 | F124: 66 | G124: 228 | H124: 217 | I124: =G124/H124 -> 1.0506912442396312
A125: dcmpun | B125: 1580 | C125: 64 | D125: 577 | E125: 60 | F125: 60 | G125: 810 | H125: 806 | I125: =G125/H125 -> 1.0049627791563276
A126: int2double | B126: 679 | C126: 329 | D126: 347 | E126: 47 | F126: 47 | G126: 400 | H126: 320 | I126: =G126/H126 -> 1.25
A127: uint2double | B127: 583 | C127: 321 | D127: 327 | E127: 47 | F127: 47 | G127: 334 | H127: 240 | I127: =G127/H127 -> 1.3916666666666666
A128: int642double | B128: 5740 | C128: 416 | D128: 451 | E128: 163 | F128: 163 | G128: 750 | H128: 661 | I128: =G128/H128 -> 1.1346444780635401
A129: uint642double | B129: 5620 | C129: 368 | D129: 453 | E129: 133 | F129: 133 | G129: 672 | H129: 592 | I129: =G129/H129 -> 1.1351351351351351
A130: fix2double | B130: 2850 | C130: 446 | D130: 1730 | E130: 110 | F130: 110 | G130: 1330 | H130: 447 | I130: =G130/H130 -> 2.9753914988814318
A131: ufix2double | B131: 2750 | C131: 397 | D131: 1710 | E131: 87 | F131: 87 | G131: 1270 | H131: 367 | I131: =G131/H131 -> 3.4604904632152587
A132: fix642double | B132: 7910 | C132: 408 | D132: 1840 | E132: 160 | F132: 160 | G132: 1690 | H132: 788 | I132: =G132/H132 -> 2.1446700507614214
A133: ufix642double | B133: 7790 | C133: 358 | D133: 1830 | E133: 127 | F133: 127 | G133: 1610 | H133: 719 | I133: =G133/H133 -> 2.2392211404728788
A134: double2int_z | B134: 410 | C134: 145 | D134: 154 | E134: 53 | F134: 53 | G134: 138 | H134: 132 | I134: =G134/H134 -> 1.0454545454545454
A135: double2int | B135: 1990 | C135: 608 | D135: 768 | E135: 267 | F135: 267 | G135: 862 | H135: 284 | I135: =G135/H135 -> 3.035211267605634
A136: double2uint | B136: 11800 | C136: 308 | D136: 1900 | E136: 53 | F136: 53 | G136: 174 | H136: 180 | I136: =G136/H136 -> 0.96666666666666667
A137: double2int64_z | B137: 4810 | C137: 539 | D137: 975 | E137: 134 | F137: 134 | G137: 127 | H137: 130 | I137: =G137/H137 -> 0.97692307692307689
A138: double2int64 | B138: 6280 | C138: 513 | D138: 1650 | E138: 313 | F138: 313 | G138: 940 | H138: 314 | I138: =G138/H138 -> 2.9936305732484074
A139: double2uint64 | B139: 6070 | C139: 207 | D139: 1170 | E139: 83 | F139: 83 | G139: 343 | H139: 353 | I139: =G139/H139 -> 0.97167138810198306
A140: double2fix | B140: 4230 | C140: 601 | D140: 2200 | E140: 438 | F140: 438 | G140: 1860 | H140: 398 | I140: =G140/H140 -> 4.6733668341708539
A141: double2ufix | B141: 13700 | C141: 306 | D141: 3340 | E141: 298 | F141: 298 | G141: 1140 | H141: 313 | I141: =G141/H141 -> 3.6421725239616611
A142: double2fix64 | B142: 8280 | C142: 505 | D142: 2960 | E142: 498 | F142: 498 | G142: 1860 | H142: 423 | I142: =G142/H142 -> 4.3971631205673756
A143: double2ufix64 | B143: 8320 | C143: 202 | D143: 2630 | E143: 85 | F143: 85 | G143: 1310 | H143: 478 | I143: =G143/H143 -> 2.7405857740585775
A144: trunc | B144: 245 | C144: 191 | D144: 111 | E144: 52 | F144: 52 | G144: 95 | H144: 65 | I144: =G144/H144 -> 1.4615384615384615
A145: round | B145: 278 | C145: 223 | D145: 171 | E145: 55 | F145: 55 | G145: 120 | H145: 81 | I145: =G145/H145 -> 1.4814814814814814
A146: floor | B146: 1400 | C146: 251 | D146: 585 | E146: 68 | F146: 68 | G146: 718 | H146: 94 | I146: =G146/H146 -> 7.6382978723404253
A147: ceil | B147: 1480 | C147: 253 | D147: 570 | E147: 71 | F147: 71 | G147: 704 | H147: 97 | I147: =G147/H147 -> 7.2577319587628866
A148: sqrt | B148: 14700 | C148: 1310 | D148: 7680 | E148: 274 | F148: 274 | G148: 7800 | H148: 710 | I148: =G148/H148 -> 10.985915492957746
A149: deg2rad | B149: 3160 | C149: 1430 | D149: 515 | E149: 280 | F149: 280 | G149: 1460 | H149: 623 | I149: =G149/H149 -> 2.3434991974317816
A150: rad2deg | B150: 3170 | C150: 1420 | D150: 513 | E150: 280 | F150: 280 | G150: 1470 | H150: 613 | I150: =G150/H150 -> 2.3980424143556283
A151: sin | B151: 40400 | C151: 13100 | D151: 9690 | E151: 1310 | F151: 1310 | G151: 20000 | H151: 2600 | I151: =G151/H151 -> 7.6923076923076925
A152: sin_deg | B152: 44300 | C152: 14500 | D152: 10400 | E152: 1560 | F152: 1560 | G152: 21400 | H152: 2770 | I152: =G152/H152 -> 7.7256317689530682
A153: cos | B153: 45200 | C153: 13000 | D153: 10600 | E153: 1280 | F153: 1280 | G153: 22200 | H153: 2990 | I153: =G153/H153 -> 7.424749163879599
A154: cos_deg | B154: 49000 | C154: 14400 | D154: 11200 | E154: 1550 | F154: 1550 | G154: 23600 | H154: 2790 | I154: =G154/H154 -> 8.4587813620071692
A155: sincos | B155: 86500 | C155: 13900 | D155: 20100 | E155: 1800 | F155: 1800 | G155: 41800 | H155: 5030 | I155: =G155/H155 -> 8.3101391650099412
A156: sincos_deg | B156: 90700 | C156: 15300 | D156: 21300 | E156: 2110 | F156: 2110 | G156: 43800 | H156: 5060 | I156: =G156/H156 -> 8.6561264822134394
A157: tan | B157: 81800 | C157: 15500 | D157: 20200 | E157: 2040 | F157: 2040 | G157: 40200 | H157: 6080 | I157: =G157/H157 -> 6.6118421052631575
A158: tan_deg | B158: 84600 | C158: 16900 | D158: 21100 | E158: 2290 | F158: 2290 | G158: 41800 | H158: 6070 | I158: =G158/H158 -> 6.8863261943986824
A159: cotan | B159: 86900 | C159: 17300 | D159: 24500 | E159: 2410 | F159: 2410 | G159: 43100 | H159: 6110 | I159: =G159/H159 -> 7.0540098199672672
A160: cotan_deg | B160: 91300 | C160: 18600 | D160: 25600 | E160: 2670 | F160: 2670 | G160: 45000 | H160: 6150 | I160: =G160/H160 -> 7.3170731707317076
A161: asin | B161: 60400 | C161: 21800 | D161: 17900 | E161: 2580 | F161: 2580 | G161: 29900 | H161: 6370 | I161: =G161/H161 -> 4.6938775510204085
A162: asin_deg | B162: 63800 | C162: 23100 | D162: 18600 | E162: 2870 | F162: 2870 | G162: 31700 | H162: 6620 | I162: =G162/H162 -> 4.7885196374622359
A163: acos | B163: 62100 | C163: 21900 | D163: 18600 | E163: 2600 | F163: 2600 | G163: 30800 | H163: 6850 | I163: =G163/H163 -> 4.4963503649635035
A164: acos_deg | B164: 65500 | C164: 23300 | D164: 19200 | E164: 2890 | F164: 2890 | G164: 32400 | H164: 6940 | I164: =G164/H164 -> 4.6685878962536025
A165: atan | B165: 62700 | C165: 17300 | D165: 15700 | E165: 1750 | F165: 1750 | G165: 30800 | H165: 4340 | I165: =G165/H165 -> 7.096774193548387
A166: atan_deg | B166: 66800 | C166: 18800 | D166: 16100 | E166: 2020 | F166: 2020 | G166: 32200 | H166: 4430 | I166: =G166/H166 -> 7.2686230248307
A167: acotan | B167: 64700 | C167: 18400 | D167: 16600 | E167: 1990 | F167: 1990 | G167: 31900 | H167: 4480 | I167: =G167/H167 -> 7.1205357142857144
A168: acotan_deg | B168: 67900 | C168: 19800 | D168: 17000 | E168: 2270 | F168: 2270 | G168: 33300 | H168: 4550 | I168: =G168/H168 -> 7.3186813186813184
A169: atan2 | B169: 68300 | C169: 17400 | D169: 20000 | E169: 1610 | F169: 1610 | G169: 34000 | H169: 5560 | I169: =G169/H169 -> 6.1151079136690649
A170: atan2_deg | B170: 71200 | C170: 18800 | D170: 20800 | E170: 1890 | F170: 1890 | G170: 35800 | H170: 6220 | I170: =G170/H170 -> 5.755627009646302
A171: sinh | B171: 42000 | C171: 6190 | D171: 12800 | E171: 814 | F171: 814 | G171: 20100 | H171: 2310 | I171: =G171/H171 -> 8.7012987012987004
A172: cosh | B172: 62400 | C172: 14200 | D172: 20500 | E172: 2100 | F172: 2100 | G172: 31300 | H172: 5050 | I172: =G172/H172 -> 6.1980198019801982
A173: tanh | B173: 65400 | C173: 4020 | D173: 20500 | E173: 715 | F173: 715 | G173: 33000 | H173: 1970 | I173: =G173/H173 -> 16.751269035532996
A174: asinh | B174: 48000 | C174: 5610 | D174: 17200 | E174: 922 | F174: 922 | G174: 24000 | H174: 2760 | I174: =G174/H174 -> 8.695652173913043
A175: acosh | B175: 86600 | C175: 12800 | D175: 32000 | E175: 2010 | F175: 2010 | G175: 44800 | H175: 7210 | I175: =G175/H175 -> 6.2135922330097086
A176: atanh | B176: 38100 | C176: 3610 | D176: 12300 | E176: 593 | F176: 593 | G176: 18900 | H176: 1900 | I176: =G176/H176 -> 9.9473684210526319
A177: exp | B177: 34300 | C177: 6110 | D177: 11400 | E177: 602 | F177: 602 | G177: 17100 | H177: 2080 | I177: =G177/H177 -> 8.2211538461538467
A178: exp2 | B178: 139000 | C178: 10600 | D178: 38100 | E178: 1690 | F178: 1690 | G178: 69100 | H178: 1820 | I178: =G178/H178 -> 37.967032967032964
A179: exp10 | B179: 191000 | C179: 7570 | D179: 57700 | E179: 865 | F179: 865 | G179: 95600 | H179: 2190 | I179: =G179/H179 -> 43.652968036529678
A180: log | B180: 42900 | C180: 7160 | D180: 13200 | E180: 861 | F180: 861 | G180: 22100 | H180: 3530 | I180: =G180/H180 -> 6.2606232294617561
A181: log2 | B181: 48100 | C181: 8570 | D181: 17000 | E181: 1140 | F181: 1140 | G181: 24000 | H181: 3440 | I181: =G181/H181 -> 6.9767441860465116
A182: log10 | B182: 50700 | C182: 8530 | D182: 14900 | E182: 1140 | F182: 1140 | G182: 26000 | H182: 3550 | I182: =G182/H182 -> 7.323943661971831
A183: expm1 | B183: 57200 | C183: 4290 | D183: 15500 | E183: 589 | F183: 589 | G183: 28100 | H183: 2040 | I183: =G183/H183 -> 13.774509803921569
A184: log1p | B184: 19200 | C184: 2830 | D184: 5580 | E184: 414 | F184: 414 | G184: 9470 | H184: 1500 | I184: =G184/H184 -> 6.3133333333333335
A185: fma | B185: 4200 | C185: 2040 | D185: 707 | E185: 491 | F185: 491 | G185: 2050 | H185: 1150 | I185: =G185/H185 -> 1.7826086956521738
A186: powint | B186: 121000 | C186: 29200 | D186: 34300 | E186: 5980 | F186: 5980 | G186: 58800 | H186: 12400 | I186: =G186/H186 -> 4.741935483870968
A187: pow | B187: 90600 | C187: 23400 | D187: 24700 | E187: 4710 | F187: 4710 | G187: 44800 | H187: 9160 | I187: =G187/H187 -> 4.890829694323144
A188: hypot | B188: 3820 | C188: 5420 | D188: 1470 | E188: 1370 | F188: 1370 | G188: 1830 | H188: 2720 | I188: =G188/H188 -> 0.67279411764705888
A189: cbrt | B189: 45900 | C189: 15200 | D189: 26200 | E189: 2270 | F189: 2270 | G189: 25500 | H189: 6300 | I189: =G189/H189 -> 4.0476190476190474
A190: absd | B190: 952 | C190: 24 | D190: 496 | E190: 14 | F190: 14 | G190: 306 | H190: 34 | I190: =G190/H190 -> 9
A191: double2float | B191: 97 | C191: 97 | D191: 217 | E191: 40 | F191: 40 | G191: 225 | H191: 218 | I191: =G191/H191 -> 1.0321100917431192
A192: average: | B192: =AVERAGE(B105:B191) -> 31189.379310344826 | C192: =AVERAGE(C105:C191) -> 6370.5517241379312 | D192: =AVERAGE(D105:D191) -> 9052.7586206896558 | E192: =AVERAGE(E105:E191) -> 895.9885057471264 | F192: =AVERAGE(F105:F191) -> 895.9885057471264 | G192: =AVERAGE(G105:G191) -> 15077.298850574713 | H192: =AVERAGE(H105:H191) -> 2204.0459770114944 | I192: =AVERAGE(I105:I191) -> 5.6612434727372349
A193: median: | B193: =MEDIAN(B105:B191) -> 7900 | C193: =MEDIAN(C105:C191) -> 1310 | D193: =MEDIAN(D105:D191) -> 2590 | E193: =MEDIAN(E105:E191) -> 328 | F193: =MEDIAN(F105:F191) -> 328 | G193: =MEDIAN(G105:G191) -> 1860 | H193: =MEDIAN(H105:H191) -> 719 | I193: =MEDIAN(I105:I191) -> 4.4963503649635035
C196: Medium timing of functions in [ns]
B197: RP2040-B2 | C197: RP2040-B2 | D197: RP2350-A2 | E197: RP2350-A2 | F197: RP2350-A2 | G197: RP2350-A2 | H197: RP2350-A2
B198: @125MHz | C198: @125MHz | D198: @150MHz | E198: @150MHz | F198: @150MHz | G198: @150MHz | H198: @150MHz
B199: libc | D199: ARM libc | E199: ARM DCP | F199: ARM DCP+VFP | G199: RISC-V libc | H199: RISC-V fast
A200: float | B200: =(B95+B96)/2 -> 12586.080459770115 | C200: =(C95+C96)/2 -> 1729.9597701149426 | D200: =(D95+D96)/2 -> 3799.844827586207 | E200: =(E95+E96)/2 -> 293.00574712643675 | F200: =(F95+F96)/2 -> 233.5287356321839 | G200: =(G95+G96)/2 -> 5830.3678160919544 | H200: =(H95+H96)/2 -> 434.58045977011494
A201: double | B201: =(B192+B193)/2 -> 19544.689655172413 | C201: =(C192+C193)/2 -> 3840.2758620689656 | D201: =(D192+D193)/2 -> 5821.3793103448279 | E201: =(E192+E193)/2 -> 611.99425287356325 | F201: =(F192+F193)/2 -> 611.99425287356325 | G201: =(G192+G193)/2 -> 8468.6494252873563 | H201: =(H192+H193)/2 -> 1461.5229885057472
A204: Comparison of effect of GCC optimization settings on C function compilation and comparison with ASM variant:
C205: RISC-V GCC compiler 13.2.0
A206: [ns] | B206: expf() Cheb | C206: logf() Cheb | D206: expf() Tayl | E206: logf() Merc
A207: "C" -O0 | B207: 4100 | C207: 5380 | D207: 5700 | E207: 10300
A208: "C" -O1 | B208: 524 | C208: 1150 | D208: 579 | E208: 1020
A209: "C" -Og -g3 | B209: 519 | C209: 1120 | D209: 604 | E209: 1030
A210: "C" -O2 | B210: 520 | C210: 727 | D210: 567 | E210: 1050
A211: "C" -O3 | B211: 520 | C211: 727 | D211: 567 | E211: 1050
A212: "C" -Ofast | B212: 520 | C212: 727 | D212: 560 | E212: 1060
A213: "C" -Os | B213: 513 | C213: *749* | D213: 564 | E213: 1030
A214: ASM | B214: 475 | C214: 633 | D214: 532 | E214: 822
A215: * = compiler included another non-inline function with similar code instead of inline